,id,title,content,category
953,7331288,"""Para mandar indirectas"": Las reacciones al nuevo álbum de Bad Bunny ""El Último Tour del Mundo""","""Para mandar indirectas"": Las reacciones al nuevo álbum de Bad Bunny ""El Último Tour del Mundo"". El Conejo Malo lo hizo de nuevo. Bad Bunny tiene a sus fanáticos revolucionados tras estrenar su más reciente álbum ""El Último Tour del Mundo"", el que ya está disponible en Spotify, Apple Music y otras plataformas digitales. En su cuenta de Instagram, el puertorriqueño deseó una feliz Navidad y agradeció el apoyo y el cariño de sus seguidores, junto con anunciar el estreno de su tercer disco este año que se suma a ""YHLQMDLG"" y ""Las que no iban a salir"". ""Gracias por apoyar mi música, mis locuras, por ustedes hago esto. Aquí les dejo mi nuevo proyecto, algo diferente. Espero que se lo gocen y lo disfruten. ¡Estamos contentos!"", dijo con un vaso en mano. View this post on InstagramA post shared by @badbunnypr A post shared by @badbunnypr El lanzamiento de ""El Último Tour del Mundo"" convirtió rápidamente el nombre de Bad Bunny en tendencia en redes sociales. Es que el nuevo trabajo del artista sorprendió con nuevos sonidos, más alejado de lo urbano, y con letras más melancólicas. Según él mismo indicó a Apple Music, el álbum está lleno de música diferente que ""le llena más"", ""muy alejado del Benito trap y más cerca de ser el Benito polivalente que él realmente quiere ser"". Varios aseguraron que las letras de Bad Bunny los pusieron tristes y que les hicieron recordar a sus exparejas, mientras otros señalaron que es el mejor álbum del cantante. “El disco de Bad Bunny es buenísimo, eso sí, el que esperaba un disco de reggaetón pues no le habrá gustado de primeras. Desde mi punto de vista es DISCAZO”; “Bad Bunny, me hiciste recordar hasta a mi ex del kinder""; “escuchando el nuevo disco de Bad Bunny y apuntando frases para mandar indirectas”, fueron algunos de los comentarios que aparecieron. En Maldita Pobreza, Bad Bunny tiene este verso: SIETE AÑOS ESTUDIANDO HASTA QUE ME GRADUE PERO NO ENCUENTRO TRABAJO EN ESO QUE ESTUDIEI really feel that bro pic.twitter.com/dqdIqJU58k— Eme Ce ? (@maricarmenlove3) November 27, 2020No he acabado todo el álbum pero ya sabíamos que Bad Bunny no haría lo mismo que hizo en el álbum anterior. Si hiciese lo mismo no sería Bad Bunny, sería Ozuna.— Alex Chiner (@AlexChiner) November 27, 2020Como pensaba que iba a estar escuchando el nuevo disco de Bad Bunny // Como he acabado escuchándolo pic.twitter.com/YYzBAanXIG— Lander⚡️ (@laander11) November 27, 2020no sé quién tuvo la culpa pero ya ni viene al caso, devuélveme mi corazón aunque sea en pedazosNAAAAAH BAD BUNNY HIJO DE PUTA— Ibai (@IbaiLlanos) November 27, 2020El disco de Bad Bunny es buenísimo, eso sí, el que esperaba un disco de reggaeton pues no le habrá gustado de primeras.Desde mi punto de vista es DISCAZO— xBuyer (@1996Javi) November 27, 2020Ya puedo escuchar uno de mis miedos en bucle. Gracias bad bunny.“Siete año' estudiando hasta que me graduéPero no encuentro trabajo en eso que estudié” pic.twitter.com/Kdf6JWACFX— xil (@buah_quefuerte) November 27, 2020Yo después de escuchar “Haciendo que me amas” de Bad Bunny ??‍♀️????‍♀️????‍♀️????‍♀️????‍♀️?? pic.twitter.com/cOrmFDNBZ8— Lis González (@LISSGONNZALEZ) November 27, 2020bad bunny me tiene así: pic.twitter.com/L3vph8PM1r— ?besos (@antonvazquezz) November 27, 2020nmms Bad Bunny me hiciste recordar hasta a mi ex del kinder— skins (@soft_skins) November 27, 2020Escuchando el nuevo disco de Bad Bunny y apuntando frases para mandar indirectas pic.twitter.com/MYEYTcXfv5— Holden Caulfield (@do0msy_) November 27, 2020Yo escuchando el nuevo disco de Bad Bunny identificándome con sus letras: pic.twitter.com/2hJEFiLWHO— ☃️Snowy An☃️ (@sanbrasyto) November 27, 2020 En Maldita Pobreza, Bad Bunny tiene este verso: SIETE AÑOS ESTUDIANDO HASTA QUE ME GRADUE PERO NO ENCUENTRO TRABAJO EN ESO QUE ESTUDIEI really feel that bro pic.twitter.com/dqdIqJU58k No he acabado todo el álbum pero ya sabíamos que Bad Bunny no haría lo mismo que hizo en el álbum anterior. Si hiciese lo mismo no sería Bad Bunny, sería Ozuna. Como pensaba que iba a estar escuchando el nuevo disco de Bad Bunny // Como he acabado escuchándolo pic.twitter.com/YYzBAanXIG no sé quién tuvo la culpa pero ya ni viene al caso, devuélveme mi corazón aunque sea en pedazosNAAAAAH BAD BUNNY HIJO DE PUTA El disco de Bad Bunny es buenísimo, eso sí, el que esperaba un disco de reggaeton pues no le habrá gustado de primeras.Desde mi punto de vista es DISCAZO Ya puedo escuchar uno de mis miedos en bucle. Gracias bad bunny.“Siete año' estudiando hasta que me graduéPero no encuentro trabajo en eso que estudié” pic.twitter.com/Kdf6JWACFX Yo después de escuchar “Haciendo que me amas” de Bad Bunny ??‍♀️????‍♀️????‍♀️????‍♀️????‍♀️?? pic.twitter.com/cOrmFDNBZ8 bad bunny me tiene así: pic.twitter.com/L3vph8PM1r nmms Bad Bunny me hiciste recordar hasta a mi ex del kinder Escuchando el nuevo disco de Bad Bunny y apuntando frases para mandar indirectas pic.twitter.com/MYEYTcXfv5 Yo escuchando el nuevo disco de Bad Bunny identificándome con sus letras: pic.twitter.com/2hJEFiLWHO  Más noticias de famosos",6-Cultura_y_Artes
956,7344328,La relación que une a Camilo Echeverry y Greeicy Rendón: Llevan 14 años de amistad,"La relación que une a Camilo Echeverry y Greeicy Rendón: Llevan 14 años de amistad. Hace poco más de 14 años, Camilo Echeverry (26) y Greeicy Rendón (27) se conocieron al formar parte de un programa de talento llamado “Factor X”. En este espacio, una de las más votadas por el público fue la colombiana, quien con su dulce voz y carisma, enamoró no solo al jurado sino también al público de su país natal. Desde entonces, el cariño que se tienen ambos artistas urbanos es tal, que a través de las redes sociales apoyan el trabajo del otro, cantando sus temas y hasta haciendo los típicos bailes de tiktok que se han vuelto toda una tradición, cuando estrenan un single.  Cuando tenían 12 y 13 años respectivamente, Camilo y Greeicy se fueron formando en el mundo del espectáculo gracias a este programa, que para la época, era uno de los más exitosos del país caribeño. Sin duda, el puntapié de lo que posteriormente se convirtió en una prometedora carrera musical para ambos. Aunque ninguno de los dos ha planeado una colaboración musical con el otro, sí se han mantenido en contacto a pesar de los distintos proyectos que realizan. Recientemente, cuando el ahora esposo de Evaluna Montaner estrenó su tema “Vida de Rico”, la artista no dudó en cantarla y bailarla junto a su actual pareja, el también cantante Mike Bahia.  Cortesía: Instagram Camilo Echeverry Esta no es la primera vez que Greeicy hace mención a un tema de su colega ya que, meses antes, cuando Camilo estrenó junto a Rauw Alejandro, el tema “Tattoo”, ella mostró el enorme tatuaje que su novio tiene de ella en la pierna. Cortesía: Instagram Greeicy Rendón La carrera musical de Camilo y Greeicy tomó fuerza a nivel internacional hace poco menos de tres años. En el caso de la colombiana, al ser asesorada por su actual pareja Mike Bahia, con quien ha tenido varias colaboraciones musicales que se han convertido en éxitos de mercados. En lo que respecta al intérprete de “Tutu”, tras su unión con la familia Montaner, logró catapultarse al éxito, que hoy -según él mismo ha dicho- le debe a su suegro.  Más noticias de Camilo y Evaluna",6-Cultura_y_Artes
967,7336462,"Ignacia Antonia y su crítica a las redes: ""No puedo pretender que mi vida se base en likes""","Ignacia Antonia y su crítica a las redes: ""No puedo pretender que mi vida se base en likes"". Ignacia Antonia (19 años) se hizo famosa en redes sociales cuando comenzó a publicar videos a través de Tiktok. Su contenido era tan atractivo para los jóvenes chilenos que, poco a poco, se fue dando a conocer hasta convertirse en la influencer que es actualmente. Al cabo de dos años, la joven cuenta con miles de seguidores no solo en esa plataforma digital, sino también, en Instagram y YouTube donde crea videos para sus fanáticos. Su pasión por las redes sociales en ese momento era tal que, para ella, se convirtió en una completa obsesión: “Hace dos años atrás me hackearon mi cuenta de Instagram y tenía el celular, lo que pasa es que no tenía Instagram, pero me sentía vacía así como que no sabía qué hacer”, dijo en un reportaje de Meganoticias. View this post on InstagramA post shared by Ignacia Hernandez? (@ignaciaa_antonia) A post shared by Ignacia Hernandez? (@ignaciaa_antonia) Diariamente, la joven influencer preparaba material audiovisual para sus fanáticos quienes, en solo minutos, le dejaban sus comentarios. Mensajes que para ella eran fundamentales. “En un momento sí se me fue de las manos y era como lo más importante para mí. Como.. ‘cuántos likes tenía’ y si subía una foto, me quedaba ahí pegada viendo cuántos likes tenía”, confesó. Una fuerte fijación que la propia Ignacia logró controlar: “Yo sola me di cuenta como que esto se me hizo una ambición, o sea, no puede ser así como que esto me va a matar en algún minuto porque, no puedo pretender que mi vida se base solo en likes o en reproducciones, eso no me va a hacer bien”, aseguró. View this post on InstagramA post shared by Ignacia Hernandez? (@ignaciaa_antonia) A post shared by Ignacia Hernandez? (@ignaciaa_antonia) Los likes y comentarios forman parte importante en la vida de los influencers e Ignacia no se queda atrás en esta búsqueda de “aceptación digital”. A pesar de esto, la joven que además es escritora, aseguró que durante la pandemia hizo lo posible por alejarse un poco de las redes sociales, para dar prioridad al tiempo de calidad con amigos y familiares. View this post on InstagramA post shared by Ignacia Hernandez? (@ignaciaa_antonia) A post shared by Ignacia Hernandez? (@ignaciaa_antonia) “Yo creo que la pandemia ayudó mucho a eso. A darse cuenta que uno necesita de la vida real. Al menos yo aprendí eso ahora, que debo darme el tiempo para estar con mis amigos, para estar con mi familia”, recalcó. Un camino que la ha llevado a aterrizar sus sueños y a trabajar por las metas que ha soñado hasta ahora, que incluyen seguir desempeñándose como escritora, además de lanzamientos de marcas como maquillaje y ropa.  Más noticias de famosos",6-Cultura_y_Artes
973,7351487,Mon Laferte ya tiene fecha para la apertura de su galería de arte en México,"Mon Laferte ya tiene fecha para la apertura de su galería de arte en México. La carrera como pintora de Mon Laferte acaba de dar un importante paso. Fue en marzo de este año cuando la cantante expuso algunas de sus obras en el Museo de Ciudad de México, demostrado que la pintura ya no solo es un pasatiempo, sino que una parte de su vida que decidió dar a conocer. La intérprete aprovechó la cuarentena para exhibir nuevas obras desde su encierro y hasta se atrevió con la xilografía, trabajos que quedan plasmados en @mon_lafArte, la cuenta de Instagram que abrió para mostrar sus obras como artista plástica. Luego en julio pasado Mon reveló a sus fanáticos otra buena noticia que se relaciona con este talento. ""Adivinen quién va a tener su pequeña galería de arte"", escribió, confirmando así que tendría su propio espacio de exposición el que finalmente verá la luz. View this post on InstagramA post shared by mon laferte (@monlaferte) A post shared by mon laferte (@monlaferte) A través de su Instagram (@monlaferte) la intérprete de ""Amor completo"" reveló que inaugurará su espacio de arte este 24 de septiembre. ""Por fin!! Desde este jueves estará abierta la galería #estoyemocionada"", escribió junto a la foto donde se ve a ella en la entrada del lugar. La galería de Mon Laferte se ubicará en Tepoztlán que es un pueblo al sur de la capital de México, país donde la cantautora reside hace ya varios años. View this post on InstagramA post shared by mon laferte (@monlaferte) A post shared by mon laferte (@monlaferte) Paralelamente la chilena continúa su carrera como cantante y el pasado jueves 17 de septiembre lanzó ""Que se sepa de una vez"", su nueva canción a dúo con el cantante mexicano Alejandro Fernández, y que será el  primer sencillo de su próximo álbum. Este será el primer disco de estudio de Mon Laferte desde su aclamado ""Norma"" en 2018, mientras que este 2020 lanzó su producción en vivo ""Sola con mis monstruos"". Ver cobertura completa",6-Cultura_y_Artes
978,7337930,"""Cada 9 de noviembre"": La historia de la canción ""Ramito de violetas"" de Zalo Reyes","""Cada 9 de noviembre"": La historia de la canción ""Ramito de violetas"" de Zalo Reyes. Como cada 9 de noviembre, el nombre de Zalo Reyes (68 años) se ha convertido en tendencia en Twitter debido a su canción ""Un ramito de violetas"", cuya letra relata la historia de una mujer que ""era feliz en su matrimonio"", pero que su marido no era lo que ella esperaba. La canción original es de la cantante española Cecilia y fue lanzada en 1974. Tal fue su éxito que durante los años posteriores varios artistas realizaron covers de ella, así como lo hizo el gorrión de Conchalí en 1985 quien alcanzó gran popularidad con el tema. Cabe destacar que la historia de la artista hispana quedó truncada por su temprana muerte a los 27 años, en un accidente automovilístico.  La letra del hit señala en una de sus estrofas que ""cada 9 de noviembre, como siempre sin tarjeta,te mandaba un ramito de violetas"", motivo por el cual la canción es recordada cada año en esa fecha e incluso varios la catalogan como el Día Nacional de Zalo Reyes. Hoy, 9 de noviembre, debo haber tramites en Conchalí, la tierra de Zalo Reyes. Es acaso un buen augurio? Yo creo que sí— Cami (@camilo_mp3) November 9, 2020El 9 de noviembre debería ser feriado nacional en homenaje al gran Zalo Reyes. Quien te escribía a ti versos, dime niña quien era.— Mallcom Moris Rodríguez (@MallcomMR9) November 9, 2020#9denoviembre Día nacional de Zalo Reyes. pic.twitter.com/IlLdSIVwwH— ????? ????????? ?. ♠♥♣♦ (@jravanales) November 9, 2020Feliz #9denoviembre para los entendidos ? (abra la foto) JAJAJA ?? pic.twitter.com/GDYcmLl9w9— ~Mabel ?❤ (@mabeparaunfinal) November 9, 2020 Hoy, 9 de noviembre, debo haber tramites en Conchalí, la tierra de Zalo Reyes. Es acaso un buen augurio? Yo creo que sí El 9 de noviembre debería ser feriado nacional en homenaje al gran Zalo Reyes. Quien te escribía a ti versos, dime niña quien era. #9denoviembre Día nacional de Zalo Reyes. pic.twitter.com/IlLdSIVwwH Feliz #9denoviembre para los entendidos ? (abra la foto) JAJAJA ?? pic.twitter.com/GDYcmLl9w9 Con motivo de esta fecha y su popular versión, Zalo Reyes realizará un concierto virtual, primera actividad por streaming en sus redes sociales en medio de la pandemia, ya que se ha mantenido en completo aislamiento social debido a la diabetes que padece. ""De hace unos años el 9 de noviembre, mi nombre ha figurado por las redes sociales cada vez con más fuerza... a puro meme y tallas sanas que obviamente me encanta"", expresó el artista a través de Instagram. View this post on InstagramA post shared by ZALO REYES (@zaloreyeselgorrion) A post shared by ZALO REYES (@zaloreyeselgorrion) ""Luego de estar encerrado 8 meses por la pandemia, haremos desde @estudiozreyes mi casa, nuestra primera actividad por streaming. No crean que es fácil, ojalá todo resulte bien con mis músicos y con la debida distancia"", indicó. La actividad se realizará este lunes 9 de noviembre a las 21 horas a través de Facebook Live y es completamente gratuita.  Más noticias de famosos",6-Cultura_y_Artes
1018,7356437,Christian Nodal se tatúa los ojos de Belinda y genera revuelo en redes sociales,"Christian Nodal se tatúa los ojos de Belinda y genera revuelo en redes sociales. El amor entre Belinda y Christian Nodal sigue con su ritmo intenso y causando revuelo en redes sociales con cada nuevo acto de la pareja mexicana. Luego de que la cantante se tatuó las iniciales de su novio en un corazón, que tenía destinado para ""el amor de su vida”, él correspondió a este gesto y se hizo dos tatuajes: las iniciales y los ojos de la intérprete de ""Luz sin gravedad"". Nodal fue el primero en compartirlo en las redes, que de forma inmediata generó dudas entre sus fans si era o no el rostro de su pareja. Fue ella quien confirmó que no se trataba de su rostro, sino que de sus ojos, pues mostró en sus historias de Instagram el resultado final del diseño.    Estas expresiones también recordaron a los cibernautas cuando se tatúo el rostro de Lupillo Rivera en uno de sus brazos, pero a diferencia de lo que realizó ahora, Belinda no hizo referencia al tatuaje de su ex en ningún momento.  Cómo que el tatuaje de Belinda es de Cristian Nodal y no de Cartoon Network. pic.twitter.com/2OJgyTBMX6— Chibi Aleh Moon? (@AlehTsukiino) September 6, 2020 Cómo que el tatuaje de Belinda es de Cristian Nodal y no de Cartoon Network. pic.twitter.com/2OJgyTBMX6  Ustedes burlándose de Lupillo por su tatuaje de Belinda y Nodal va para allá también xd pic.twitter.com/DlWsF4VIrP— bebecita bebelin (@_______naat) September 7, 2020 Ustedes burlándose de Lupillo por su tatuaje de Belinda y Nodal va para allá también xd pic.twitter.com/DlWsF4VIrP Veo el tatuaje y solo pienso en que su futura novia va a sentirse muy juzgada por Belinda mientras hagan el frutifantastico pic.twitter.com/xUkPlDppAR— Marco (@TooAcosta) September 7, 2020 Veo el tatuaje y solo pienso en que su futura novia va a sentirse muy juzgada por Belinda mientras hagan el frutifantastico pic.twitter.com/xUkPlDppAR Este no fue el único gesto de amor que se hizo la pareja, ya que la semana pasada fue su aniversario de su primer mes en el que se lo celebraron a lo grande. Fue una romántica cena con música en vivo, sushi y detalles personalizados, como platos con sus nombres y un pastel con emojis de un osito panda y una ratoncita ( como ellos se llaman de cariño). Además de esta velada,  se tenían unos lujosos regalos. Belinda le regaló a su novio un brazalete de diamantes con las letras “C” y “B”, el número cuatro y el símbolo infinito. Christian por otra parte, le entregó a su novia un collar, también de diamantes con la palabra “Nodeli”, el nombre que sus seguidores le dieron a la pareja. ",6-Cultura_y_Artes
1021,7332245,"Cami es nominada a un Premio Grammy por su álbum ""Monstruo"": Celebró en redes sociales","Cami es nominada a un Premio Grammy por su álbum ""Monstruo"": Celebró en redes sociales. La cantante chilena Camila Gallardo, conocida popularmente como Cami, puede celebrar un nuevo hito en su carrera, pues fue nominada por la Academia de Grabación a los Premios Grammy, en la categoría de Mejor Álbum Latino de Rock o Música Alternativa. La artista postula al premio gracias al disco ""Monstruo"", el segundo en su carrera y que fue lanzado en su totalidad en el mes de marzo de este 2020, que incluye sencillos como ""La entrevista"" y ""Aquí estoy"", entre otros, consolidándola en la escena internacional,  y logrando gran alcance en Latinoamérica. Cami había sido nominada anteriormente a los Grammy Latinos 2019 con Mejor Nuevo Artista y Mejor álbum vocal pop tradicional por “Rosa”. A través de su cuenta oficial en Twitter, la chilena se mostró sorprendida por la nominación, agradeciendo a quienes la nominaron. ""No lo puedo creer. !Gracias, gracias! Nominados a mejor álbum alternativo con Monstruo. NO LO PUEDO CREER GRACIAS GRACIAS GRACIAS!!! NOMINADOS A MEJOR ÁLBUM ALTERNATIVO CON MONSTRUO @RecordingAcad #GRAMMYs— CAMI (@soycamioficial) November 24, 2020 NO LO PUEDO CREER GRACIAS GRACIAS GRACIAS!!! NOMINADOS A MEJOR ÁLBUM ALTERNATIVO CON MONSTRUO @RecordingAcad #GRAMMYs En su categoría, la intérprete de ""Querida Rosa"" competirá con: Congratulations 63rd #GRAMMYs Best Latin Rock Or Alternative Album nominees: @Bajofondo, @soycamioficial, @culturaprofetic, @FitoPaezMusica, and @LidoPimienta: https://t.co/teAbOeBzZ9 pic.twitter.com/2DenqgDI7P— Recording Academy / GRAMMYs (@RecordingAcad) November 24, 2020 Congratulations 63rd #GRAMMYs Best Latin Rock Or Alternative Album nominees: @Bajofondo, @soycamioficial, @culturaprofetic, @FitoPaezMusica, and @LidoPimienta: https://t.co/teAbOeBzZ9 pic.twitter.com/2DenqgDI7P Una vez conocida su nominación, las redes sociales estallaron en mensajes para Cami, felicitándola por su esfuerzo para llegar a estar entre los grandes de la música en el planeta. Cami y Fito nominados a los Grammy soy puras lagrimas— Clara (@ClariGomeez) November 24, 2020 Cami y Fito nominados a los Grammy soy puras lagrimas  ¡¡¡CAMI NOMINADA A UN GRAMMY!!! ?❤️Se lo merece taaanto, representando a todos los artistas chilenos. Grandísima @soycamioficial ??✊?— Karina Isabel (@kaisbarrxfandom) November 24, 2020 ¡¡¡CAMI NOMINADA A UN GRAMMY!!! ?❤️Se lo merece taaanto, representando a todos los artistas chilenos. Grandísima @soycamioficial ??✊? ?| CAMI ESTÁ NOMINADA A LOS GRAMMY EN LA CATEGORÍA MEJOR ÁLBUM ALTERNATIVO! pic.twitter.com/T82F1woZzM— TEAM CAMI CHILE (@teamcamicl) November 24, 2020 ?| CAMI ESTÁ NOMINADA A LOS GRAMMY EN LA CATEGORÍA MEJOR ÁLBUM ALTERNATIVO! pic.twitter.com/T82F1woZzM  Todo sobre famosos chilenos",6-Cultura_y_Artes
1033,7310564,"""Me sentí violentada"": Difunden video de Vicente Fernández haciendo tocaciones a una fanática","""Me sentí violentada"": Difunden video de Vicente Fernández haciendo tocaciones a una fanática. Vicente Fernández se ha metido en un escándalo luego de que se hiciese viral un polémico video, donde aparece tocándole el busto a una joven fanática que le pidió una fotografía. En las imágenes se puede observar al cantante rodeado de otras mujeres. Sin embargo, fue a la admiradora que se le sentó a su lado derecho a la cual sin motivo aparente decidió ubicarle la mano en el seno, mientras que las otras dos participantes de la fotografía no se percataron de lo ocurrido. El contenido no tardó en hacerse viral y la opinión pública reaccionó de inmediato ante lo que muchos consideraron una acción violenta que no contó con el consentimiento de la joven. Te puede interesarLa ""novia"" de 19 años de Marc Anthony contó detalles de su encuentro Tras la difusión del video en la red social TikTok, la joven decidió dar su versión de los hechos. En una grabación para el programa ""De Primera Mano"", la muchacha explicó lo que sucedió en aquel momento cuando le pidió una fotografía a Vicente Fernández. ""Esa foto la tomaron en 2017, la razón por la que mi expresión se ve tranquila no es porque me gustó, más bien fue porque no me di cuenta que su mano estaba ahí hasta que observé las fotografías con mi mamá"", dijo. La joven, que prefirió no dar su nombre al público, agregó: ""Yo estaba usando un brasier con relleno y es muy difícil sentir algo, más porque estaba en la parte de abajo, no me di cuenta hasta que la vi en redes"".Posteriormente señaló que se enojó mucho por la actitud del cantante mexicano en aquel momento, y que se sintió violentada. ""Me sentí violentada, enojada con el señor, y todos lo están defendiendo. Manejo mis traumas con humor y sarcasmo, cada quien tiene sus mecanismos de defensa"", dijo.  La chica finalizó sus declaraciones diciendo que Vicente Fernández nunca debió poner sus manos sobre ella, y aprovechó para enmarcar la situación con el contexto violento bajo el que viven otras mujeres mexicanas. ""No me importa que sea Vicente Fernández, él no debió de haber tocado mi cuerpo sin mi permiso, sobre todo en esa área. Estoy segura que muchas mujeres han experimentado lo mismo"", concluyó. Hasta los momentos ni Vicente Fernández ni ningún otro integrante de su familia, ha salido a dar declaraciones sobre la polémica. Su último post en Instagram fue en diciembre para promocionar una portada junto a sus hijos. View this post on InstagramA post shared by Vicente Fernández (@_vicentefdez) A post shared by Vicente Fernández (@_vicentefdez) Todo sobre Famosos Si eres víctima o testigo de violencia hacia la mujer el fono de orientación dispuesto por el @minmujeryeg es el 1455. El número se puede marcar tanto en teléfono fijo como en el celular y desde ahí brindan orientación para ayudar a víctimas de maltrato o te guían con los mecanismos para realizar una denuncia. Si eres víctima o testigo de violencia hacia la mujer el fono de orientación dispuesto por el @minmujeryeg es el 1455. El número se puede marcar tanto en teléfono fijo como en el celular y desde ahí brindan orientación para ayudar a víctimas de maltrato o te guían con los mecanismos para realizar una denuncia.",6-Cultura_y_Artes
