,id,title,content,category
446,7331129,Desde Ricky Martin hasta Karol G: Bad Bunny se rodea de celebridades en nuevo videoclip,"Desde Ricky Martin hasta Karol G: Bad Bunny se rodea de celebridades en nuevo videoclip. La madrugada de este viernes, Bad Bunny estrenó su nuevo disco ""El Último Tour del Mundo"", que cuenta con 16 temas, incluido su más reciente éxito “Dákiti”, junto a Jhay Cortez, que ya cuenta con más de 200 millones de reproducciones en la plataforma de YouTube. Ahora que el álbum está disponible para el público, el “Conejo Malo” también lanzó el video musical de “Yo Visto Así” que cuenta con la participación de grandes artistas internacionales como el cantante Ricky Martin, la actriz Sofía Vergara, las estrellas del género urbano Sech y Karol G, la modelo/actriz Ruby Rose, el boxeador Ryan García y el beisbolista puertorriqueño Francisco Lindor.  Además de una aparición especial de nada menos que uno de los hermanos de Bad Bunny, Bernie Martínez, quien sorprende por el gran parecido que tiene con el artista de trap. En mitad del video, todos ellos hacen una corta aparición, en un tema que habla de la amplia variedad de estilos de vestimenta que la gente luce alrededor del mundo, bajo el mensaje de que cada uno de los looks es tan válido como el otro. En su cuenta de Instagram, el ""Conejo Malo"" deseó una feliz Navidad y agradeció el apoyo y el cariño de sus seguidores junto con anunciar el estreno en dichas plataformas. ""Gracias apoyar mi música, mis locuras, por ustedes hago esto. Aquí les dejo mi nuevo proyecto, algo diferente. Espero que se lo gocen y lo disfruten. ¡Estamos contentos!"", dijo con un vaso en mano. View this post on InstagramA post shared by @badbunnypr A post shared by @badbunnypr Días antes de anunciar la portada de este álbum, el puertorriqueño aseguró que las 16 canciones que incluye son ""temazos"". A primera vista algunos lo son, ya que el artista cuenta con la colaboración de Rosalía (""La noche de anoche"") y Jhay Cortez (""Dákiti""). Esta última canción ya superó los 205 millones de reproducciones en YouTube y se ubica en el primer lugar del Top 50 de Chile, según Spotify. 1. TEMAZO?2. TEMAZO?3. TEMAZO?4. TEMAZO?5. TEMAZO ?6. TEMAZO ?7. TEMAZO ?8. TEMAZO ?9. TEMAZO ?10. TEMAZO ?11. TEMAZO ?12. TEMAZO ?13. TEMAZO ?14. TEMAZO ?15. TEMAZO ?16. TEMAZO ?— ? (@sanbenito) November 24, 2020 1. TEMAZO?2. TEMAZO?3. TEMAZO?4. TEMAZO?5. TEMAZO ?6. TEMAZO ?7. TEMAZO ?8. TEMAZO ?9. TEMAZO ?10. TEMAZO ?11. TEMAZO ?12. TEMAZO ?13. TEMAZO ?14. TEMAZO ?15. TEMAZO ?16. TEMAZO ? El video promocional del álbum fue publicado en su cuenta de Instagram. En él aparece frente a los periodistas para anunciar las palabras que tienen en vilo a los fanáticos. ""Buenos días a todos, gracias por estar aquí. Voy a ser breve con ustedes, la razón por la que estoy aquí es para anunciarles mi retiro de la música"", señala. Después aparece el propio Bad Bunny, con una risa irónica, apagando la televisión en que la que estaba viendo la conferencia. Se para de su sillón y desempolva el cartucho que guarda su nuevo disco en formato vinilo para reproducirlo.  Más noticias de famosos Ver cobertura completa",6-Cultura_y_Artes
460,7331348,"Camilo lanzó nueva canción y Evaluna lo sorprendió con baile: ""Qué guapa es mi esposa""","Camilo lanzó nueva canción y Evaluna lo sorprendió con baile: ""Qué guapa es mi esposa"". ""Bebé"" se titula el nuevo tema lanzado por el colombiano Camilo Echeverry que busca con su nueva canción convertirse en un hit, tal como ya lo ha hecho con sus sencillos ""Vida de rico"" o ""Favorito"". El nuevo tema del ganador del Grammy Latino 2020 cuenta con un video tributo a República Dominicana, y con la colaboración de El Alfa, y tres invitados muy especiales: los padres y hermana de Camilo. Tanto ""Bebé"" como ""Vida de Rico"" formarán parte del nuevo álbum de estudio del colombiano, el cual será lanzado a principios de 2021. Como cada tema de Camilo, su nuevo sencillo también cuenta con un challenge en TikTok el que fue realizado casi de inmediato por su esposa, la actriz y cantante de 23 años de edad, Evaluna Montaner. @camiloNo bailo como mi esposa, pero le meto jajajaja♬ BEBÉ - Camilo & El Alfa No bailo como mi esposa, pero le meto jajajaja La joven, que además es la directora del videoclip, aparece bailando al ritmo de la bachata de la nueva canción, lo que desató miles de miles de likes y comentarios de sus seguidores incluyendo el de su reconocido esposo. View this post on InstagramA post shared by C A M I L O (@camilo) A post shared by C A M I L O (@camilo) ""¡Bachatéame mami... qué guapa es mi esposa!¡Quiero verlas y verlos bailando BEBÉ a todos!!!! @evaluna"", expresó el cantante al compartir el video.  Más noticias de Camilo y Evaluna  Más noticias de famosos",6-Cultura_y_Artes
465,7341384,Blu Jerusalema: ¿Qué significa el nombre de la hija de Gianluca Vacchi y Sharon Fonseca?,"Blu Jerusalema: ¿Qué significa el nombre de la hija de Gianluca Vacchi y Sharon Fonseca?. Gianluca Vacchi y su novia Sharon Fonseca anunciaron, el pasado martes 27 de octubre de 2020, a través de las redes sociales el nacimiento de su primera hija en un hospital de Miami. La llegada de la bebé era esperada por los millones de seguidores de la pareja, quienes quedaron sorprendidos por el nombre de la recién nacida. El excéntrico millonario italiano, de 53 años, y la modelo venezolana, de 25, decidieron llamar a su primogénita Blu Jerusalema; el mismo nombre de uno de los temas más sonados y bailados este 2020, que se ha viralizado en las redes sociales por su pegadizo ritmo. View this post on InstagramA post shared by Gianluca Vacchi (@gianlucavacchi) A post shared by Gianluca Vacchi (@gianlucavacchi) Vacchi se volvió toda una celebridad precisamente por colgar graciosos videos de sus bailes en internet, donde ha conseguido millones de admiradores gracias a sus excentricidades. La publicación en la que el influencer europeo compartió el nombre de su hija ya supera los tres millones de ""like"", y más de 84 mil comentarios de sus fanáticos. ""Ya viste el nombre que le pusieron a la niña"", observó uno; mientras otro agregaba de forma graciosa, ""esa niña tendrá mucho ritmo"". La canción Jerusalema fue lanzada, en diciembre de 2019, por el músico sudafricano Master KG con la voz de la artista Nomcembo Zikod, según la revista Rolling Stones.  El tema se viralizó luego de que un grupo de amigos realizara una coreografía y la difundiera a través de diferentes plataformas web. Enseguida miles de personas replicaron el baile a nivel mundial haciéndolo popular. El video oficial ya supera los 200 millones de reproducciones en Youtube, mientras que en Tik Tok ya alcanza los miles de millones. Mientras que el nombre ""Jerusalema"" está inspirado en la interpretación bíblica de la ciudad de Jerusalén, como madre celestial, según explica la editorial norteamericana. ""Es una canción espiritual, basada en la religión que se practica en el lugar donde nací. Está inspirada en la creencia de que existe una Jerusalén de arriba, la celestial y una Jerusalén de abajo, la terrenal. Nunca pensé que iba a ser tan famosa"", dijo el creador en una entrevista con Infobae.  Más noticias de famosos",6-Cultura_y_Artes
470,7345687,¿Nueva demostración de amor? Nodal y Belinda se hacen la misma marca en su rostro,"¿Nueva demostración de amor? Nodal y Belinda se hacen la misma marca en su rostro. “Ya se me anda mimetizando mi amorcito bello”, fue el mensaje que usó Christian Nodal (21 años) para mostrar en su cuenta de Twitter, la nueva “marca” que él y Belinda (31) se hicieron en el rostro, como demostración de amor. Se trata de dos pequeñas rayitas que ambos se hicieron en las cejas. Ya se me anda mimetizando mi amorcito bello ?????? pic.twitter.com/HJ5khsW9nH— Nodal? (@elnodal) October 10, 2020 Ya se me anda mimetizando mi amorcito bello ?????? pic.twitter.com/HJ5khsW9nH Este detalle se suma a los “actos de amor” que ha hecho el uno por el otro, desde que hicieron pública su relación hace poco más de cinco meses. Desde uñas pintadas con sus nombres, hasta tatuajes, han sido las formas en las que ‘Nodeli’, nombre con el que se hacen llamar como pareja, han decidido inmortalizar su amor. Christian Nodal se ha hecho tres tatuajes en el cuerpo para demostrar su amor por la intérprete de “Pobre Niña Nice”. El primero son los ojos de la mexicana que se los dibujó de forma permanente en su pecho, el segundo es el nombre en diminutivo de la cantante -“Beli”- que se hizo en una de sus orejas.  El tercero, lo hizo en conjunto con la artista mexicana, donde sale un arco de flecha con el número 4. Este último tatuaje también lo tiene Belinda pero con una pequeña diferencia: En vez de un arco, ella tiene un corazón flechado.  Otro gesto de amor hecho por Belinda para complacer a su novio, fue tatuarse las iniciales de Nodal en un corazón que tenía en su tobillo desde hace años y en el cual había dicho que pondría el nombre del amor de su vida, cuando lo conociera.",6-Cultura_y_Artes
472,7338784,Natti Natasha alimenta rumores del quiebre entre Karol G y Anuel AA,"Natti Natasha alimenta rumores del quiebre entre Karol G y Anuel AA. Desde hace ya un buen tiempo que los rumores de la ruptura entre la pareja de reggaetoneros, Anuel AA y Karol G se viene dando en las redes sociales, luego que ambos dejaran de mostrarse al público tan cercanos como antes. Sin embargo, un nuevo factor ha incrementado este posible ""quiebre"". Resulta que Mike Towers convocó a Natti Natasha y Anuel AA para el remix de su canción, ""Diosa"", la cual fue anunciada hace unas semanas. Desde entonces, la actual pareja de Karol G y la intérprete de ""Sin Pijama"", han estado compartiendo mensajes en sus redes sociales, compartiéndose sus publicaciones, etiquetándose en comentarios, con el objetivo de promocionar la nueva canción. Sin embargo, esta cercanía ha molestado a los fans de la pareja, quienes han interpelado en varias ocasiones a Natti Natasha de haber provocado un ""quiebre en la pareja"" entre la colombiana y el puertorriqueño. De hecho, uno de los seguidores le comentó a la cantante de ""No voy a llorar"", que luego de haber grabado el video de ""Diosa"", ella se fue con Anuel a su casa. Pero ella retrucó al usuario, señalándole que en realidad, no fue después ""fue antes"". BOOOOM baby!! @NattiNatasha Diabla y Diosaaaa ?? pic.twitter.com/ZmRRLbZiSh— Fede Varin (@FedeVarin) October 28, 2020 BOOOOM baby!! @NattiNatasha Diabla y Diosaaaa ?? pic.twitter.com/ZmRRLbZiSh Si bien pudo haber sido una respuesta en broma, el contexto en el que se da, en medio de rumores de separación entre los ""bebecitos"". En redes sociales principalmente, se dice que la pareja favorita de la música latinoamericana terminó, debido a que ya no suben fotos juntos, no promocionan el trabajo del otro y ni siquiera se dan me gusta en sus fotografías. Sumado a ello, en estos últimos días han estado subiendo misteriosos mensajes a sus redes sociales. Anuel AA por ejemplo, el pasado 30 de octubre subió un post a Instagram que muchos interpretaron como una señal de que terminó con Karol. View this post on InstagramA post shared by “REAL HASTA LA MUERTE” (@anuel) A post shared by “REAL HASTA LA MUERTE” (@anuel) Y asimismo, la cantante de ""Tusa"" no se ha quedado atrás. En Twitter expresó: ""Amig@, los años y la experiencia te cambian. Cambian tus gustos, tu forma de pensar y ver la vida. Obviamente no somos los mismos de antes"". La gente se extraña por que años atrás no hacías algo que ahora haces o porque años atrás hacías algo que hoy dejaste de hacer ... Amig@, los años y la experiencia te cambian. Cambian tus gustos, tu forma de pensar y ver la vida... obviamente no somos los mismos de antes ...— BICHOTA (@karolg) October 29, 2020 La gente se extraña por que años atrás no hacías algo que ahora haces o porque años atrás hacías algo que hoy dejaste de hacer ... Amig@, los años y la experiencia te cambian. Cambian tus gustos, tu forma de pensar y ver la vida... obviamente no somos los mismos de antes ... Cabe destacar que ninguno de los dos cantantes ha aclarado realmente lo que ocurre en su relación.  Más noticias de Karol G",6-Cultura_y_Artes
484,7336423,The Weeknd es el elegido para el show del mediotiempo del Super Bowl 2021,"The Weeknd es el elegido para el show del mediotiempo del Super Bowl 2021. El Super Bowl 2021 ya comienza a tomar forma y este jueves se conoció quién será el artista encargado de realizar el codiciado show del mediotiempo. La NFL reveló que será The Weeknd quien brindará el show de la próxima edición que se realizará el 7 de febrero de 2021, aún sin lugar ni equipos definidos. ""El show de medio tiempo que transmitirá CBS con The Weeknd de seguro será nada menos que trascendental"", expresaron desde la Liga. The #PepsiHalftime Show on @CBS featuring @theweeknd is sure to be nothing short of transcendent ? @Pepsi @rocnation #SBLV pic.twitter.com/EkG3eGaHRO— NFL (@NFL) November 12, 2020 The #PepsiHalftime Show on @CBS featuring @theweeknd is sure to be nothing short of transcendent ? @Pepsi @rocnation #SBLV pic.twitter.com/EkG3eGaHRO ""Actuando en el escenario icónico. Nos vemos 02/07/21"", escribió el artista canadiense de 30 años anunciando la noticia en sus redes sociales. View this post on InstagramA post shared by The Weeknd (@theweeknd) A post shared by The Weeknd (@theweeknd) De esta manera llegará a ocupar el lugar que este 2020 vio brillar a Jennifer Lopez y Shakira, que fueron las encargadas del show en el entretiempo de la 54 edición con una impactante presentación que además incluyó a Bad Bunny y J Balvin, siendo la primera vez en que una estrella latina encabezaba el famoso espectáculo.  The Weeknd, cuyo verdadero nombre es Abel Makkonen Tesfaye, llegará al Super Bowl con una exitosa carrera que suma tres premios Grammy y populares temas como ""Can't Feel my Face"", ""Call Out my Name"" y ""I feel you coming"". Además, este año lanzó su álbum ""After Hours"" con el hit ""Blinding Lights"" y recientemente sorprendió cantando en español en el remix de ""Hawaii"" con Maluma.",6-Cultura_y_Artes
509,7339762,"""Baby Shark"" destrona a ""Despacito"" de Luis Fonsi como lo más visto en YouTube","""Baby Shark"" destrona a ""Despacito"" de Luis Fonsi como lo más visto en YouTube. La canción infantil ""Baby Shark"" se convirtió en el video más visto en la historia de YouTube tras superar las 7.050 millones de reproducciones, dejando por detrás a ""Despacito"" de Luis Fonsi, quien desde el 2017 regía como el ""rey"" de la red social de videos.  La pegajosa canción de la compañía educativa surcoreana Pinkfong, está en la plataforma desde el 17 de junio del 2016 y poco a poco ha roto varios récords. El año 2019, por ejemplo, logró entrar en la lista Billboard Top 100, ranking que recoge las canciones más escuchadas en Estados Unidos. ""Sin el amor y el apoyo de nuestros seguidores por todo el mundo, el nuevo récord de Baby Shark no hubiera sido posible"", dijo en un comunicado Min Seok Kim, el consejero delegado de SmartStudy, matriz de Pinkfong, según relata El Mundo. ""Nos sentimos muy honrados por este récord y seguiremos enfocados en la producción de entretenimiento de alta calidad más allá de las plataformas digitales"", añadió. Baby Shark swims to the top of YouTube, officially becoming the No. 1 most-viewed YouTube video in history, with 7.04 billion YouTube views!Thanks for all your love and support, everyone!Watch Baby Shark Dance: https://t.co/MVc3sFwkFp#BabySharkNo1 #BabyShark #BabySharkDance pic.twitter.com/TsyBvG83lT— pinkfong_usa (@pinkfong_usa) November 2, 2020 Baby Shark swims to the top of YouTube, officially becoming the No. 1 most-viewed YouTube video in history, with 7.04 billion YouTube views!Thanks for all your love and support, everyone!Watch Baby Shark Dance: https://t.co/MVc3sFwkFp#BabySharkNo1 #BabyShark #BabySharkDance pic.twitter.com/TsyBvG83lT A pesar de perder el número uno en la plataforma de videos, Fonsi no se quiso quedar fuera de la popularidad de la canción infantil, y en julio pasado lanzó su propia versión del ""Baby Shark"" de la mano de Pinkfong, acumulando hasta ahora más de 106 millones de visitas.  La melodía infantil en todo caso no es del gusto de todo el público, ya que algunos padres no son muy fanáticos de la canción del pequeño tiburón. Además, se ha reportado que en Estados Unidos incluso se utilizó la tonada como método de tortura para reos.",6-Cultura_y_Artes
511,7332391,"Gala Caldirola se somete a tratamiento facial para ""eliminar"" las arrugas","Gala Caldirola se somete a tratamiento facial para ""eliminar"" las arrugas. A través de las redes sociales, la modelo española Gala Caldirola (27) sorprendió a sus seguidores, al revelar que estaba iniciando un nuevo tratamiento facial para “eliminar” las arrugas que tiene en su rostro, naturales de la edad. Junto con explicar lo que iba a inyectarse, la ahora esposa del futbolista chileno Mauricio Isla, aseguró que “por herencia”, tiene más líneas de expresión que lo habitual, por lo que con este procedimiento busca “rejuvenecer” su rostro. “Me voy a hacer un botox preventivo, porque yo genéticamente tengo marcadas las arrugas de la cara, expresiones faciales por ejemplo en la frente, si ves tengo muchísimo, también los ojos, entonces quiero como rejuvenecer mi rostro y para eso voy a colocar un poco de botox en la frente, que va a estirar la frente, voy a acentuar el arco de las cejas y voy a hacer también el contorno de los ojos”, dijo en sus stories de Instagram. Tras la explicación, el doctor procedió a inyectar su frente y demás zonas deseadas por la española.  Hace más de cuatro años, Gala Caldirola se inyectó ácido hialurónico en los labios, para provocar un efecto más carnoso en ellos. Sin embargo, ahora busca eliminar este producto por completo y volver a la “normalidad”. Ante este deseo, la exparticipante de reality shows ha estado realizando un tratamiento para reducir el grosor de sus labios. De hecho, hace semanas, una foto de la española llamó la atención y es que se veían los moretones en la zona de la boca. “Me infiltré hialuronidasa para disolver el ácido hialurónico que me puse hace unos años, en unos días desaparecerán los moretones”, escribió en ese momento, para evidenciar que no se ha vuelto a inyectar ácido en los labios.  Más noticias de famosos",6-Cultura_y_Artes
512,7350877,Con Kidd Tetoon y Pablo Chill-E: Festival urbano online reunirá a exponentes del trap chileno,"Con Kidd Tetoon y Pablo Chill-E: Festival urbano online reunirá a exponentes del trap chileno. Un nuevo panorama en pandemia es el que se prepara para el próximo 10 de octubre y tendrá como protagonistas a varios de los exponentes de la escena urbana chilena. Se trata del Chile TrapFest, el primer festival urbano online que reunirá a diez cantantes del género, incluidos los más populares del momento. El Chile TrapFest contará con la presencia de Pablo Chill-E, Polimá Westcoast, Harry Nach y Drefquila, entre otros. A ellos se suman Kidd Tetoon y Diego Smith quienes recientemente hicieron noticia ya que harán un remix junto a Ozuna de su tema ""Illuminati"". Además, Kidd dio un importante paso en su carrera pues firmó con el sello The Orchard, que pertenece a Sony Music Latin, lo cual se concretó durante una gira y visita laboral a Miami, Estados Unidos, la que coincidió además con su cumpleaños. View this post on InstagramA post shared by @kiddtetoon A post shared by @kiddtetoon ""Gracias a Dios y a todo mi equipo de trabajo hoy firme con @the_orchard_ y @sonymusiclatin gracias por aceptarme en esta tremenda familia"", escribió junto a la firma del contrato. La lista de artistas para el Chile TrapFest se completa con Soulfia, Kidpoison, Nico Baby y Drago 200. View this post on InstagramA post shared by KLLE (@klle.media) A post shared by KLLE (@klle.media) Las entradas para el Chile TrapFest están disponibles a través de Passline y estarán a la venta a partir del próximo 29 de febrero .",6-Cultura_y_Artes
513,7311452,"Adiós a un grande: Fallece Mario Gutiérrez, icónico fundador de Los Ángeles Negros","Adiós a un grande: Fallece Mario Gutiérrez, icónico fundador de Los Ángeles Negros. La música chilena está de luto tras el fallecimiento de Mario Gutiérrez, fundador y guitarrista histórico del grupo nacional Los Ángeles Negros. A sus 71 años, su deceso ocurrió en México. La noticia fue confirmada por sus familiares y la propia banda musical a través de sus redes sociales, quienes rogaron a sus fans y seguidores que oren por el ""eterno descanso"" del artista, sin precisar las causas de su muerte. ""Queridos amigos, fans y seguidores de esta leyenda llamada Mario Hernán Gutiérrez Contreras, fundador de Los Angeles Negros, guitarrista insigne de esta emblemática agrupación chilena, jamás reconocida en su magnitud en su tierra, Chile"", manifestó la banda en un comunicado. ""Elevemos una sentida oración para que su transición sea ligera, y sea recibido con un coro de ángeles celestiales, para su eterno descanso"", agregan. En el mismo escrito, la familia de Gutiérrez agradecieron el cariño y apoyo recibido durante su carrera musical: ""Papito, tus hijos, nueras y nietos te damos un agradecimiento eterno por habernos elegido ser tu descendencia. Vuela alto y que tus aplausos merecidos te acompañen. Ya nos volveremos a encontrar"".  La banda chilena nació a finales de la década de los '60, como una casualidad del destino. Esto, ya que Gutiérrez y otros dos integrantes, el baterista Cristián Blasser y el bajista bajista Sergio Rojas, necesitaban un vocalista para participar en un concurso. Fue así como dieron con Germaín de la Fuente, iniciando una carrera musical que los llevó a incluso ser comparados con The Beatles, la famosa banda británica. Después de años exitosos vivieron un periodo de inconveniencias, marcado por los quiebres y los retornos. Sin embargo, el guitarrista se mantuvo siempre como el miembro original, completando 52 años en grupo nacido en el sur de Chile. Todo sobre Famosos chilenos",6-Cultura_y_Artes
520,7335404,"De ""La Casa de Papel"" y ""Élite"" a cantante: El vuelco que dio Jaime Lorente en su carrera","De ""La Casa de Papel"" y ""Élite"" a cantante: El vuelco que dio Jaime Lorente en su carrera. Denver, en “La Casa de Papel”, y Nano, en “Élite”, han sido los papeles más conocidos del actor español Jaime Lorente, quien ha saltado a la fama a nivel internacional por su profesionalismo y carisma. Estas dos interpretaciones le han abierto puertas en el mundo del séptimo arte, convirtiéndolo en uno de los actores europeos más populares del momento. A pesar de que le esperaba un futuro prometedor en el mundo de la actuación, durante la pandemia Lorente decidió darle un cambio rotundo a su carrera artística, incursionando en la música. “Siempre me ha gustado rapear, desde pequeño lo hacía, pero nunca me lo había tomado en serio hasta ahora. Yo creo que el confinamiento ha sido el que me ha dado el empujón ha llevar más allá la música”, explicó Lorente acerca de su nuevo proyecto, a varios medios españoles. Tras varios meses de confinamiento, el artista lanzó su primer EP con dos canciones tituladas “Corazón” y “Acércate”, temas que muestran un estilo musical que mezcla rap, pop y algo de baile.  Con respecto a “Corazón”, el español de 28 años de edad aseguró que con este single lo van a poder conocer más a fondo. “Es un espejo donde la gente va a ver quién soy literalmente, van a conocer al Jaime Lorente que soy en realidad, por lo que abrirme de esta manera significa mucho para mí. Hay una especie de encuentro donde me veo a mí mismo de pequeño y me pregunto ‘¿en qué me he convertido?’”, relató. Aunque Jaime Lorente esté experimentando una nueva rama del espectáculo, no significa que haya dejado atrás la actuación. Todo lo contrario, el actor asegura tener la convicción de seguir trabajando para llevar entretención al público que lo sigue. Un ejemplo de ello es que, en diciembre, la plataforma de contenidos vía streaming Amazon Prime estrenará “El Cid”, una serie histórica española protagonizada por Lorente que fue rodada en plan “Game of Thrones”. Además, en su país se encuentra presentando el monólogo teatral “Matar Cansa”.   Más noticias de famosos",6-Cultura_y_Artes
