,id,title,content,category
1515,7352157,"""Lo que necesitábamos"": La reacción en redes tras la reunión de las actrices de Friends","""Lo que necesitábamos"": La reacción en redes tras la reunión de las actrices de Friends. Este 2020 debía estrenarse el regreso de la serie Friends en un capítulo especial, pero todo quedó aplazado debido a la pandemia de coronavirus. Por eso, un breve momento en la emisión de los Premios Emmy, sirvió para que los fanáticos de la serie saltaran de la alegría. Antes del inicio de la entrega de galardones en el apartado de drama, el anfitrión Jimmy Kimmel hizo un contacto mediante Zoom con la actriz Jennifer Aniston, quien solo momentos antes estuvo en el Staples Center presentando una categoría. Mientras Aniston supuestamente se arreglaba en su casa, aparecieron en pantalla Courteney Cox y Lisa Kudrow, quienes personificaron a Monica y Phoebe en la mítica serie de los años 90 y que terminó en 2004. El breve momento también incluyó la aparición de Jason Bateman, quien lanzó un chiste alusivo a su presencia en el Staples Center, tras lo cual fue ""invitado"" a retirarse. En redes sociales celebraron la pequeña reunión, y los usuarios aseguraron que les da esperanza respecto al capítulo que quedó aplazado para el próximo año. El tridente femenino de Friends presente en los #Emmys pic.twitter.com/Zq1gBKQYyQ— ??? ?????????? (@dealerdepelis) September 21, 2020 El tridente femenino de Friends presente en los #Emmys pic.twitter.com/Zq1gBKQYyQ La reunión que todos queríamos ver #Friends #Emmys pic.twitter.com/q1nm6LTuZN— JaviPonzo (@JaviPonzo) September 21, 2020 La reunión que todos queríamos ver #Friends #Emmys pic.twitter.com/q1nm6LTuZN Ellas 3 siempre ❤️#Friends #Emmys2020 pic.twitter.com/pZ3Sj9idgm— La Cosa Cine (@lacosacine) September 21, 2020 Ellas 3 siempre ❤️#Friends #Emmys2020 pic.twitter.com/pZ3Sj9idgm Quedate con quien te mire como #CourteneyCox a #JenniferAniston #Friends #Emmys2020 pic.twitter.com/aIzIgQGJEI— JaviPonzo (@JaviPonzo) September 21, 2020 Quedate con quien te mire como #CourteneyCox a #JenniferAniston #Friends #Emmys2020 pic.twitter.com/aIzIgQGJEI Phoebe Rachel y Monica juntas es todo lo que está bien en 2020. #Emmys#Friends pic.twitter.com/yHL5YQZWeP— Lupita Caldiño ?? (@lupitacaldi) September 21, 2020 Phoebe Rachel y Monica juntas es todo lo que está bien en 2020. #Emmys#Friends pic.twitter.com/yHL5YQZWeP La casi reunión de Friends que necesitaba. Gracias #Emmys2020 pic.twitter.com/ucDmz97saG— Ana Salcedo (@anamsalcedoa) September 21, 2020 La casi reunión de Friends que necesitaba. Gracias #Emmys2020 pic.twitter.com/ucDmz97saG La ceremonia virtual se podrá ver en vivo, doblado en español, a través de TNT; y en su idioma original en TNT Series. En ambos canales el certamen comenzará a partir de las 21:00 horas. Ver cobertura completa",6-Cultura_y_Artes
1523,7321723,Video deja en evidencia posible reconciliación entre Marité Matus y Daniel Valenzuela,"Video deja en evidencia posible reconciliación entre Marité Matus y Daniel Valenzuela. En mayo de 2020, la exesposa del futbolista Arturo Vidal informó su quiebre amoroso con el locutor de radio Daniel Valenzuela, luego de que una de sus seguidoras le preguntara al respecto: “¿Ya no estás con Daniel?” fue la interrogante. De inmediato, Maité Matus respondió: “Le he respondido mil veces, ya no estamos juntos”. Con esto quedó confirmada la ruptura amorosa entre ambos, terminando así con los “likes” en las redes sociales que tenían uno con el otro, además de los frecuentes viajes de Valenzuela a España, país donde la también modelo vive con sus tres hijos.  En los últimos meses, el tema sobre esta pareja había finalizado, hasta que Marité pisó suelo nacional para pasar las fiestas de Navidad y Año Nuevo en nuestro país, junto a su familia, pues esto generó nuevamente comentarios por parte de sus miles de seguidores en la web, quienes siguen “expectantes” a una posible reconciliación. Aunque nada indicaba que podrían estar juntos, un video de Ignacia Antonia abrió nuevamente las posibilidades de un retorno amoroso entre Marité y Daniel. En el clip, publicado en su cuenta de TikTok, la influencer hizo un challenge junto a su novio -Max Valenzuela-, las hijas del locutor -Alondra y Eloísa- y el hijo de Marité -Monito Vidal-. Esto hizo estallar nuevamente los rumores de un supuesto regreso: “Una pregunta, ¿volviste con la Marité?”, “Marité está en Chile, solo falta que confirmen”, “¿Te vas a reencontrar con la Marité?”, “Esta tu amor en Chile”, fueron algunos de los comentarios en la cuenta de Valenzuela. @ignaciaa_antoniaJajaja amo este trend ❤️♬ original sound - BABY LONDON? Jajaja amo este trend ❤️ Hasta ahora, ninguno de los dos ha confirmado ninguna información al respecto, ni mucho menos se han dejado ver juntos compartiendo en lugares públicos. Por el momento, ambos se encuentran “solteros” y disfrutando de estas fiestas de Navidad y Año Nuevo junto a sus respectivos familiares y amigos. Todo sobre Famosos chilenos",6-Cultura_y_Artes
1526,7354466,"Drew Barrymore y Adam Sandler se reúnen en la versión 2020 de ""Como si fuera la primera vez""","Drew Barrymore y Adam Sandler se reúnen en la versión 2020 de ""Como si fuera la primera vez"". Emoción causó en los fanáticos de la película ""Como si fuera la primera vez"" la reunión virtual que llevaron a cabo Drew Barrymore y Adam Sandler, quienes protagonizan la romántica historia estrenada en 2004. El encuentro se dio en el contexto del nuevo programa de entrevistas de la actriz y en el adelanto se ve a Lucy (Barrymore) despertando y viendo un video de su esposo, Henry (Sandler), explicando su vida juntos desde que tiene amnesia recurrente diaria. Sin embargo, el nuevo video está actualizado para el 2020, 16 años después de su estreno y en medio de la pandemia del coronavirus por lo que Henry explica que ahora se juega béisbol frente a recortes de cartón de personas, qué es Netflix y por qué todos están con mascarillas. ""Como si fuera la primera vez"" fue un éxito tras su estreno en 2004 y se convirtió en una de las cintas favoritas de los fanáticos de las historias románticas.  El video termina con Sandler deseando a Barrymore lo mejor en su nuevo programa y la actriz diciendo que no podría comenzar sin que él sea parte del momento. The Drew Barrymore Show se estrena el lunes 14 de septiembre a través de CBS y contará con invitados de lujo como Reese Witherspoon, Jane Fonda, Charlize Theron y Tyra Banks, entre otros.",6-Cultura_y_Artes
1531,7322091,"Daddy Yankee confirma la tercera parte de su concierto virtual: día, hora y famosos invitados","Daddy Yankee confirma la tercera parte de su concierto virtual: día, hora y famosos invitados. Como un regalo para sus fans antes de concluir el año, el artista puertorriqueño Daddy Yankee anunció la tercera parte de su concierto virtual ""2K20"". El exponente del género urbano lanzó en su canal de YouTube las primeras dos partes del concierto, que ya superan las diez millones de visitas. A pesar de que originalmente se había anunciado que esta tercera parte del show sería publicada la noche del 21 de diciembre, Daddy Yankee confirmó en su más reciente publicación que la última entrega de la saga 2K20 se estrenará el 24 de diciembre a las 22:00 horas (ET). View this post on InstagramA post shared by Daddy Yankee (@daddyyankee) A post shared by Daddy Yankee (@daddyyankee) En su cuenta de Instagram, el artista reveló que en esta oportunidad le acompañarán otros notables artistas como Anuel AA, Ozuna y Natti Natasha. También aparecerán Zuleyka Rivera y Luis Fonsi. Este último interpretando una estelar versión en vivo del éxito musical ""Despacito"". View this post on InstagramA post shared by Daddy Yankee (@daddyyankee) A post shared by Daddy Yankee (@daddyyankee) Producido por el promotor de conciertos Rafael Pina y presentado por AT&T, la presentación fue grabada el 5 de diciembre de 2019 en el Coliseo de Puerto Rico José Miguel Agrelot, en medio de la serie de conciertos ""Con Calma Pal' Choli"". El espectáculo, que duró tres noches, batió récords al ser la única serie en vender más de 170.000 boletos en un mes, convirtiéndose en el show más taquillero en la historia de Puerto Rico. Adicionalmente, Daddy Yankee lanzó un sencillo junto a Marc Anthony titulado ""De vuelta para la vuelta"" en el cual se mezclan los ritmos del reggaetón y la salsa. View this post on InstagramA post shared by Daddy Yankee (@daddyyankee) A post shared by Daddy Yankee (@daddyyankee) Yankee publicó un gracioso video en su perfil de Instagram en el cual se puede ver cómo durante el rodaje del tema junto al exesposo de Jennifer López el artista se percató de que una cámara oculta lo estaba grabando. Este llamó la atención al camarógrafo que intentaba tomarlo desprevenido. ""Cuando intentan grabarte a escondidas, esto es lo que sucede. Solo Pinarazzi puede hacerlo y 'a veces"", comentó el intérprete de ""Gasolina"" junto al clip. Hasta Rafael Pina respondió al post con una aclaratoria: ""Yo no fui, por si acaso"", ante la molestia del reguetonero. View this post on InstagramA post shared by Daddy Yankee (@daddyyankee) A post shared by Daddy Yankee (@daddyyankee)",6-Cultura_y_Artes
1546,7327185,"Di Mondo y el duro momento para salvar la empresa de su novio: ""Trabajamos como perros""","Di Mondo y el duro momento para salvar la empresa de su novio: ""Trabajamos como perros"". Modelo chileno, influencer y también con estudios en administración de empresas. Así es Di Mondo, el excéntrico fanático de la moda que ahora está desarrollando su faceta empresarial para ayudar a su novio Eric Javits. La pandemia del coronavirus les trajo serios dolores de cabeza. Javits se dedica a crear cotizadas carteras y sombreros, los cuales han sido utilizados por grandes celebridades como Madonna y Jennifer López. Sin embargo, por la crisis sanitaria, el negocio estuvo a punto de cerrar sus puertas. View this post on InstagramA post shared by Di Mondo (@itsdimondosworld) A post shared by Di Mondo (@itsdimondosworld) Tras la cancelación de pedidos y el cierre de las tiendas comerciales, las ventas disminuyeron drásticamente. Ante ello, la figura chilena decidió intervenir por primera vez en la empresa de la pareja y planteó resistidas estrategias de venta. ""A pocos les gustaban mis ideas, pero siempre he tenido un lado para los negocios"", cuenta Di Mondo a LUN. Nuevas publicidades y una fuerte inversión trajeron consigo los primeros ingresos en meses. El éxito llegó a tal nivel que ahora el chileno es jefe de operaciones de la empresa que lleva el mismo nombre de su novio, Eric Javits. View this post on InstagramA post shared by Di Mondo (@itsdimondosworld) A post shared by Di Mondo (@itsdimondosworld) Pero su éxito laboral también está en base a su esfuerzo: ""Literalmente trabajamos como perros con Eric y todo el equipo. Por casi dos meses llegábamos a las 06.30 de la mañana a la oficina y nos quedábamos hasta la noche, pero no me importa porque me encanta el rol empresarial"", comentó el influencer. La nueva rutina de Di Mondo es diferente: ""Paso el día coordinando muchas cosas. Es bastante intenso, estoy involucrado en temas operacionales, inventarios, sesiones de fotos. Tengo el objetivo de crear una nueva cultura en la empresa"". View this post on InstagramA post shared by Di Mondo (@itsdimondosworld) A post shared by Di Mondo (@itsdimondosworld) Por su parte, el empresario Eric Javits no tiene más que agradecimientos para Di Mondo: ""Detrás de esa extraordinaria y mágica creatividad hay un pensador estratégico. Él motivó a otros a hacer el trabajo e intervino para salvar mi negocio"". ""En nuestra relación de 15 años, Di Mondo me ha influido y me ha ayudado a ver un enfoque diferente, uno que quizás no haya considerado o que sentí que no podía hacer"", finalizó el estadounidense.  Todo sobre Famosos chilenos",6-Cultura_y_Artes
1548,7314176,"Selena Gomez cautiva a sus fans cantando en español su nuevo tema ""De una vez""","Selena Gomez cautiva a sus fans cantando en español su nuevo tema ""De una vez"". Selena Gomez abraza sus raíces mexicanas e interpreta en español ""De una vez"", cantándole al amor con una composición que muchos apuestan, se trata de una nueva era para la estrella estadounidense de 28 años. La intérprete de música pop ha logrado conquistar el top 10 en el Billboard 200 en varias oportunidades con su trabajo en los estudios y esta vez confirma que regresó renovada, con una apariencia diferente, logrando sorprender a sus fans con un ritmo que suena a urbano. Como bien destaca el portal Los 40, no todos los días un cantante toma otro idioma para lanzar un sencillo que la deja en otro escenario musical, en el que debuta con un nuevo ritmo, que para muchos fascinó por su puesta original y una sonoridad que queda bien con su tono de voz. View this post on InstagramA post shared by Selena Gomez (@selenagomez) A post shared by Selena Gomez (@selenagomez) Este lanzamiento trae un video producido con la mayor creatividad y calidad visual para contar la historia de su nueva canción, en la que Selena Gomez enamora con un estilismo fresco y hermoso, en el que incluye un decorado de flores en su cabeza con una melena suelta, junto a un vestido midi rosa pálido de delicado estampado floral que eleva su look juvenil.  Con la frase ""Ya no duele como antes"" y en un viaje a través del corazón, comienza el clip que la deja ver nuevamente portando ese corazón en su pecho, para confirmar que le dedica el protagonismo a una joven que despertó sana de la ruptura de un viejo amor.  Y es que el tema así lo dice: ""La herida de tu amor sanó""; ""No me arrepiento del pasado""; ""No tengo a ti, me tengo a mi""; ""Estoy curada de ti""; ""No me supiste valorar"" y ""Ahora el techo es antibalas"" son parte de las frases de una composición musical que habla de una Selena, que está curada de sus decepciones amorosas del pasado y le da paso a una mujer feliz y renovada, destaca el diario Milenio. En el video, Selena da pasos firmes por toda una casa decorada con una alfombra verde, maletas, guitarra y un gran sofá en el que posa sentada mirando fijamente a la cámara, mientras su pecho palpita en rojo en cada paso que da y al final el techo de esa vivienda se libera y es “antibalas”, lo que le da el fin a su historia, cerrando una puerta. View this post on InstagramA post shared by Fan Account ?? (@selenagomzbr) A post shared by Fan Account ?? (@selenagomzbr) Los fans estallaron de inmediato delirando de amor por su artista con el nuevo tema y aunque es de poca duración, solo 2 minutos, su voz en español cautivó, aludiendo a la sensualidad en cada parte de su pronunciación, y emocionando así a sus millones de seguidores. todos confirmamos que Selena Gómez es una diosaaaa y que la rompió con esta canción? pic.twitter.com/TN3YBYXl73— una watermelon (@chrryjb) January 15, 2021 todos confirmamos que Selena Gómez es una diosaaaa y que la rompió con esta canción? pic.twitter.com/TN3YBYXl73  Excuse me, Selena Gomez cantando again en español y con una pronunciación TAN buena m tiene on the floorrr— nalinnnn (@analinestrada) January 15, 2021 Excuse me, Selena Gomez cantando again en español y con una pronunciación TAN buena m tiene on the floorrr se sabe que este año será bueno en la música porque no van ni 2 semanas de que es 2021 y ya tenemos las 2 mejores canciones y ambas hechas x mujeres, que diosas son Ariana Grande y Selena Gomez neta pic.twitter.com/dVxwZq5l4w— perra dientes separados (@camilo_franc) January 15, 2021 se sabe que este año será bueno en la música porque no van ni 2 semanas de que es 2021 y ya tenemos las 2 mejores canciones y ambas hechas x mujeres, que diosas son Ariana Grande y Selena Gomez neta pic.twitter.com/dVxwZq5l4w",6-Cultura_y_Artes
1563,7309830,"¿Será papá, es una canción o una campaña?: Maluma genera especulaciones con misterioso posteo","¿Será papá, es una canción o una campaña?: Maluma genera especulaciones con misterioso posteo. Maluma compartió este domingo una fotografía en sus redes sociales, la que generó todo tipo de especulaciones entre sus seguidores. Y es que el reconocido cantante colombiano posteó una imagen en su cuenta personal de Instagram recostado sobre el vientre de una mujer, de la que no se conoce su identidad. En el registro se le puede ver relajado y esbozando una leve sonrisa, aunque todas las miradas se situaron en un curioso mensaje que aparece en la foto. Te puede interesarPareja de Ingrid Aceitón agradece mensajes de apoyo tras pérdida de su bebé ""#7DJ"" es el mensaje que se aprecia en la imagen y que dejó atónitos a los fanáticos del reggeatonero, quienes comenzaron a preguntarse de qué se trataba. Algunos pusieron en los comentarios que posiblemente se trata de una canción o campaña, aunque la mayoría de las teorías se inclinaron por la posibilidad de que el cantante esté esperando un hijo. ""¿Qué pasó?"", ""qué es eso, dime"" y ""explica, por favor"", “Maluma baby”, “Debe esperar un bebé para el 7 de junio”, “Otro disco” y “Calma gente será un sobrino, ahijado, primo o cualquier parentesco; excepto un hijo”, fueron algunas de las reacciones de sus seguidores en Instagram, quienes no pudieron contener la emoción. El posteo fue subido por Maluma cerca de las 19:00 horas y en pocos minutos llegó a tener más de 500 mil ""Me Gusta"". View this post on InstagramA post shared by MALUMA (@maluma) A post shared by MALUMA (@maluma) Maluma va a tener un bebé y no es conmigo. ???Qué más puede pasar hoy ?!? pic.twitter.com/fSVQ1d5MqK— Kris ? (@kris_go8) January 24, 2021 Maluma va a tener un bebé y no es conmigo. ???Qué más puede pasar hoy ?!? pic.twitter.com/fSVQ1d5MqK Yo viendo la foto que Maluma subió a Instagram ?️??️. ?❤️? pic.twitter.com/hJkeXODzwP— Fans de Ariana G, Aidan gallagher y Maluma (@Mariana05316908) January 24, 2021 Yo viendo la foto que Maluma subió a Instagram ?️??️. ?❤️? pic.twitter.com/hJkeXODzwP  se viene un maluma baby acaso? dea pic.twitter.com/KCvrfwwvtw— fatu; (@lostinlou1) January 24, 2021 se viene un maluma baby acaso? dea pic.twitter.com/KCvrfwwvtw Maluma ""Baby"" ? pic.twitter.com/9RDyxKYYPk— кellყ• ʀᴋ ? (@alecriimls) January 24, 2021 Maluma ""Baby"" ? pic.twitter.com/9RDyxKYYPk Creo que no estoy entendiendo bien esta foto... Maluma va a ser padre?? pic.twitter.com/ewqafraQqn— Nuria Ibáñez (@IPNuria) January 24, 2021 Creo que no estoy entendiendo bien esta foto... Maluma va a ser padre?? pic.twitter.com/ewqafraQqn #Maluma baby?FIRST REACTION: SHOCK ??‍♀️ pic.twitter.com/iCsLXd924v— ?????????? ???? (@Raffa_moody) January 24, 2021 #Maluma baby?FIRST REACTION: SHOCK ??‍♀️ pic.twitter.com/iCsLXd924v Todo sobre Famosos Todo sobre Maluma",6-Cultura_y_Artes
1572,7317365,"Revelan la verdad tras el sorprendente ""nuevo rostro"" de The Weeknd","Revelan la verdad tras el sorprendente ""nuevo rostro"" de The Weeknd. Como muchos sospechaban, el ""nuevo rostro"" de The Weeknd que asombró al mundo entero se trató simplemente de un elaborado maquillaje, realizado a base de prótesis, que modeló y cambió totalmente la fisonomía del cantante canadiense. Aunque pareció demasiado real, el rostro que mostró el controversial cantante en el video de su tema ""Save Your Tears"", con unos pómulos altos, labios súper gruesos por bótox y una nariz perfilada; se trató de una nueva actuación que quiso realizar para la presentación de su clip de lanzamiento. View this post on InstagramA post shared by The Weeknd (@theweeknd) A post shared by The Weeknd (@theweeknd) Y si el objetivo era llamar la atención, el álbum ""After Hours"" logró ser el foco central en el mundo del espectáculo internacional al impactar en millones de fans que cuestionaban el dramático cambio en la cara de The Weeknd, haciendo que el cantante fuese tendencia en las redes sociales en muchos países. View this post on InstagramA post shared by The Weeknd Hell (@theweekndhell) A post shared by The Weeknd Hell (@theweekndhell) The Weeknd no pudo tener un mejor inicio en el 2021 que el logrado con su video musical ""Save Your Tears"", el cual quedará en el recuerdo de sus fanáticos como una magistral actuación del cantante, quien es dueño de una “performance” única para interpretar sus temas en escena. View this post on InstagramA post shared by Mike Marino (@prorenfx) A post shared by Mike Marino (@prorenfx) Según el diario Us Magazine, el ""nuevo look"" del artista fue ""estrictamente arte escénico"", con lo que explicó que el debut de Año Nuevo que realizó la súper estrella de la canción fue solo una estrategia para promocionar su tema. Y su nueva actuación resultó ser una prótesis creada por Mike Marino de Prosthetic Renaissance, el mismo cerebro que está detrás de los disfraces de Halloween de Heidi Klum, detalló el portal estadounidense. View this post on InstagramA post shared by Mike Marino (@prorenfx) A post shared by Mike Marino (@prorenfx) En su cuenta Instagram publicó todo el proceso, incluidos los moldes utilizados para crear el rostro transformado: el mentón largo, labios hinchados y los prominentes pómulos. View this post on InstagramA post shared by Mike Marino (@prorenfx) A post shared by Mike Marino (@prorenfx) Todo sobre Famosos",6-Cultura_y_Artes
1581,7348021,"La ""promesa de amor"" de Karol G y Anuel que se viralizó tras rumores de separación","La ""promesa de amor"" de Karol G y Anuel que se viralizó tras rumores de separación. Karol G y Anuel AA se han convertido en una de las parejas más queridas de la música urbana y ambos a través de sus redes sociales se han encargado de demostrarse cariño y amor desde que comenzaron su relación en 2018. Sin embargo, no han estado exentos de polémicas, y hace algunos días circuló el rumor de que ambos habrían terminado. Los intérpretes de ""Secreto"" se habían mostrado siempre muy cercanos e inseparables a través de sus redes sociales, pero las cosas cambiaron en los últimos meses, donde han sido más herméticos. Karol y Anuel pasaron semanas sin compartir nada juntos y todo tomó más fuerza luego de que la intérprete de ""Ay Dios mío!"" viajara sola a su natal Colombia a ver a su familia, mientras él se quedó en la mansión que comparten en Miami y donde pasaron juntos la cuarentena por el coronavirus. En medio de ese escenario comenzó a circular una entrevista en la red social de Clip, donde se puede ver a ambos prometerse amor eterno ante la cámara, a pesar de que también se mostraron nerviosos. View this post on InstagramA post shared by ???“LA FAMILIA NUNCA MUERE""??? (@anuelkeii_) A post shared by ???“LA FAMILIA NUNCA MUERE""??? (@anuelkeii_) ""Hoy que es el día del amor ¿estarían dispuestos a hacerse una promesa de amor frente a nuestras cámaras?"", les dice la periodista, ante lo que la colombiana responde mirando a Anuel: ""Amor, prometo amarte y respetar para siempre, dale dame el dedito"" y hacen el gesto de juntar los meñiques en señal de promesa. Todo cambió hace unos días justo cuando ya varios medios especulaban del quiebre sentimental y fue la propia Karol G quien se encargó de demostrar que siguen más juntos que nunca. La cantante subió una historia a su perfil de Instagram junto a su perro Goku, el bulldog inglés que la pareja tiene como mascota hace ya varios meses. El cachorro aparece durmiendo y ella escribió ""te extraño papá, ya casi te veo @anuel"". Ver cobertura completa",6-Cultura_y_Artes
